{
  "schema_version": "digest.v1",
  "user_id": "usr_demo0001",
  "device_id": "dev_demo0001",
  "generated_at": "2026-08-01T09:14:00Z",
  "corpus": {
    "message_count": 83887,
    "thread_count": 422,
    "first_message_at": "2025-08-01T00:00:00Z",
    "last_message_at": "2026-07-31T22:41:00Z",
    "span_days": 365,
    "green_share": 0.31,
    "messages_in_icloud": true,
    "retention_boundary": "1y_exact",
    "days_since_newest": 0,
    "health": "fixable",
    "health_reasons": [
      "keep_messages_1y"
    ],
    "as_of": "2026-08-01T09:14:00Z"
  },
  "relationships": [
    {
      "contact_id": "h_8f21a4c0",
      "display": "Maya",
      "is_group": false,
      "message_count": 1204,
      "sent_count": 551,
      "received_count": 653,
      "days_since_last_contact": 12,
      "momentum_90d": 0.62,
      "initiation_ratio": 0.41,
      "archetype": null,
      "as_of": "2026-08-01T09:14:00Z",
      "first_contact_at": "2025-08-04T18:22:00Z",
      "last_contact_at": "2026-06-11T21:03:00Z",
      "median_reply_latency_s": {
        "user": 340,
        "them": 58
      },
      "p90_reply_latency_s": {
        "user": 9800,
        "them": 900
      },
      "tapbacks": {
        "given": 18,
        "received": 22
      },
      "muted_by_them": false,
      "green_share": 0.0,
      "calls": {
        "count": 9,
        "total_seconds": 7420,
        "initiated_by_user": 5,
        "missed": 1
      },
      "last_from_me": false,
      "max_gap_days": 30,
      "unanswered_question": true,
      "facts": {
        "dates": [
          "the 14th"
        ],
        "times": [],
        "places": [],
        "amounts": [],
        "names": []
      }
    },
    {
      "contact_id": "h_3c77e910",
      "display": "Yu",
      "is_group": false,
      "message_count": 2380,
      "sent_count": 1102,
      "received_count": 1278,
      "days_since_last_contact": 51,
      "momentum_90d": 0.04,
      "initiation_ratio": 0.48,
      "archetype": "fade",
      "as_of": "2026-08-01T09:14:00Z",
      "first_contact_at": "2025-08-04T18:22:00Z",
      "last_contact_at": "2026-06-11T21:03:00Z",
      "median_reply_latency_s": {
        "user": 16,
        "them": 16
      },
      "p90_reply_latency_s": {
        "user": 240,
        "them": 300
      },
      "tapbacks": {
        "given": 40,
        "received": 38
      },
      "muted_by_them": false,
      "green_share": 0.0,
      "calls": {
        "count": 3,
        "total_seconds": 1180,
        "initiated_by_user": 1,
        "missed": 0
      },
      "last_from_me": true,
      "max_gap_days": 51,
      "unanswered_question": false,
      "facts": {
        "dates": [],
        "times": [],
        "places": [],
        "amounts": [],
        "names": []
      }
    },
    {
      "contact_id": "h_ba0192df",
      "display": "Mom",
      "is_group": false,
      "message_count": 3110,
      "sent_count": 1050,
      "received_count": 2060,
      "days_since_last_contact": 2,
      "momentum_90d": 0.91,
      "initiation_ratio": 0.34,
      "archetype": "the_one_you_keep_waiting",
      "as_of": "2026-08-01T09:14:00Z",
      "first_contact_at": "2025-08-04T18:22:00Z",
      "last_contact_at": "2026-06-11T21:03:00Z",
      "median_reply_latency_s": {
        "user": 340,
        "them": 95
      },
      "p90_reply_latency_s": {
        "user": 21600,
        "them": 1800
      },
      "tapbacks": {
        "given": 4,
        "received": 51
      },
      "muted_by_them": false,
      "green_share": 0.0,
      "calls": {
        "count": 61,
        "total_seconds": 48200,
        "initiated_by_user": 19,
        "missed": 7
      },
      "last_from_me": true,
      "max_gap_days": 64,
      "unanswered_question": false,
      "facts": {
        "dates": [],
        "times": [],
        "places": [],
        "amounts": [],
        "names": []
      }
    },
    {
      "contact_id": "h_5d40cc18",
      "display": "Dre",
      "is_group": false,
      "message_count": 1711,
      "sent_count": 842,
      "received_count": 869,
      "days_since_last_contact": 198,
      "momentum_90d": 0.0,
      "initiation_ratio": 0.51,
      "archetype": "chapter",
      "as_of": "2026-08-01T09:14:00Z",
      "first_contact_at": "2025-08-04T18:22:00Z",
      "last_contact_at": "2026-06-11T21:03:00Z",
      "median_reply_latency_s": {
        "user": 6,
        "them": 6
      },
      "p90_reply_latency_s": {
        "user": 90,
        "them": 120
      },
      "tapbacks": {
        "given": 12,
        "received": 9
      },
      "muted_by_them": null,
      "green_share": 1.0,
      "calls": {
        "count": 0,
        "total_seconds": 0,
        "initiated_by_user": 0,
        "missed": 0
      },
      "last_from_me": true,
      "max_gap_days": 198,
      "unanswered_question": false,
      "facts": {
        "dates": [],
        "times": [],
        "places": [],
        "amounts": [],
        "names": []
      }
    },
    {
      "contact_id": "h_9e21b7aa",
      "display": "Priya",
      "is_group": false,
      "message_count": 640,
      "sent_count": 410,
      "received_count": 230,
      "days_since_last_contact": 7,
      "momentum_90d": 1.8,
      "initiation_ratio": 0.64,
      "archetype": "one_way_enthusiasm",
      "as_of": "2026-08-01T09:14:00Z",
      "first_contact_at": "2025-08-04T18:22:00Z",
      "last_contact_at": "2026-06-11T21:03:00Z",
      "median_reply_latency_s": {
        "user": 45,
        "them": 5400
      },
      "p90_reply_latency_s": {
        "user": 600,
        "them": 86400
      },
      "tapbacks": {
        "given": 32,
        "received": 1
      },
      "muted_by_them": true,
      "green_share": 0.0,
      "calls": {
        "count": 1,
        "total_seconds": 240,
        "initiated_by_user": 1,
        "missed": 0
      },
      "last_from_me": true,
      "max_gap_days": 98,
      "unanswered_question": false,
      "facts": {
        "dates": [],
        "times": [],
        "places": [],
        "amounts": [],
        "names": []
      }
    }
  ],
  "whole_life": {
    "total_messages": 83887,
    "unique_people": 422,
    "global_median_reply_s": 210,
    "concentration_top1": 0.11,
    "concentration_top5": 0.38,
    "concentration_top10": 0.55,
    "relationships_gone_quiet": 10,
    "relationships_ranked": 25,
    "late_night_share": 0.19,
    "as_of": "2026-08-01T09:14:00Z"
  }
}
