{
  "schema_version": "digest.v1",
  "user_id": "usr_demo0001",
  "device_id": "dev_demo0001",
  "generated_at": "2026-08-01T09:14:00Z",
  "corpus": {
    "message_count": 412,
    "thread_count": 19,
    "first_message_at": "2026-07-08T00:00:00Z",
    "last_message_at": "2026-07-31T22:41:00Z",
    "span_days": 24,
    "green_share": 0.31,
    "messages_in_icloud": false,
    "retention_boundary": null,
    "days_since_newest": 0,
    "health": "thin",
    "health_reasons": [
      "new_mac",
      "icloud_off"
    ],
    "as_of": "2026-08-01T09:14:00Z"
  },
  "relationships": [
    {
      "contact_id": "h_8f21a4c0",
      "display": "Maya",
      "is_group": false,
      "message_count": 1204,
      "sent_count": 551,
      "received_count": 653,
      "days_since_last_contact": 12,
      "momentum_90d": 0.62,
      "initiation_ratio": 0.41,
      "archetype": null,
      "as_of": "2026-08-01T09:14:00Z",
      "first_contact_at": "2025-08-04T18:22:00Z",
      "last_contact_at": "2026-06-11T21:03:00Z",
      "median_reply_latency_s": {
        "user": 340,
        "them": 58
      },
      "p90_reply_latency_s": {
        "user": 9800,
        "them": 900
      },
      "tapbacks": {
        "given": 18,
        "received": 22
      },
      "muted_by_them": false,
      "green_share": 0.0,
      "calls": {
        "count": 9,
        "total_seconds": 7420,
        "initiated_by_user": 5,
        "missed": 1
      },
      "last_from_me": false,
      "max_gap_days": 30,
      "unanswered_question": true,
      "facts": {
        "dates": [
          "the 14th"
        ],
        "times": [],
        "places": [],
        "amounts": [],
        "names": []
      }
    }
  ],
  "whole_life": {
    "total_messages": 412,
    "unique_people": 19,
    "global_median_reply_s": 210,
    "concentration_top1": 0.11,
    "concentration_top5": 0.38,
    "concentration_top10": 0.55,
    "relationships_gone_quiet": 0,
    "relationships_ranked": 1,
    "late_night_share": 0.19,
    "as_of": "2026-08-01T09:14:00Z"
  }
}
